Produto,Preço,Descrição,Embalagem
SmartWatch,259.99,"Smartwatch de ultima geracão e o mais completo, Simplifique sua vida e eleve seu estilo",papelão
Fones de ouvido Bluetooth,189.99,"Fones de Ouvido Bluetooth com áudio de alta qualidade, design elegante e ergonômico",papelão
Raquete de tênis ,329.99,"Raquete de tênis com uma potência explosiva, conforto aprimorado e durabilidade superior",tecido
Patins,219.99,"Patins projetados para proporcionar uma experiência de patinação excepcional, combinando estilo e conforto",plastico
Coleira antipulgas,109.99,"Coleira premium para cães e gatos, materiais de alta qualidade, construção durável e segura",plastico
